Pergunta,Resposta
O que é licenca maternidade?,"A licença-maternidade é um benefício garantido na Constituição para todas as mulheres que são contribuintes da Previdência Social (INSS). Por meio desse benefício, as mulheres podem se ausentar do trabalho, sem perdas salariais por, no mínimo, 120 dias. O benefício é concedido nos casos em que a mulher gera e dá à luz a um bebê e também quando adota uma criança."
Com quantas semanas da pra ver o sexo do bebê?,"É possível saber o sexo do bebê a partir da 8ª semana de gravidez, através de um exame de sangue específico (sexagem fetal) ou a partir da 13ª semana pelo ultrassom."
Quanto tempo dura a gestação?,"De acordo com a Febrasgo, Federação Brasileira das Associações de Ginecologia e Obstetrícia, uma gestação a termo, ou seja, dentro do período ""certo"", é da 39ª até a 40ª semana e 6 dias."
"Eu não sei quem é o pai, o que eu faço?","A única forma de saber com certeza quem é o pai é pelo exame de DNA. Porém, em algumas situações é possível calcular a data de fecundação que pode sugerir quem é o pai.
- Se o intervalo das relações sexuais com os diferentes parceiros tiver sido de menos de 10 dias, só o teste de DNA pode dar uma resposta exata mesmo. A comparação entre o tipo sanguíneo do bebê com o da mãe e o dos possíveis pais em alguns casos pode dar a resposta, mas em muitos não dá.
- Se o intervalo das relações sexuais com os diferentes parceiros tiver sido de mais de 10 dias, dá para tentar calcular a data da fecundação para descobrir quem é o pai."
Como eu calculo a data de fecundação?,"Há duas maneiras de calcular: pela data da última menstração e pela data provável do parto.
Para calcular pela menstruação basta somar 11 e 21 dias ao primeiro dia da última menstruação. Por exemplo, se a última menstruação apareceu no dia 5 de Abril, significa que a concepção deve ter acontecido entre os dias 16 a 26 de Abril.
Se você não lembra a data da sua última menstruação é possível descobrir utilizando a data provável do parto. Basta subtrair 40 semanas da data provável do parto e aí você tem a data do primeiro dia da última menstração e então, é só fazer a mesma conta. Por exemplo, se a data prevista do parto é dia 10 de Novembro, deve-se retirar 40 semanas para descobrir o possível primeiro dia da última menstruação, que, neste caso será o dia 3 de Fevereiro. A esse dia, deve-se agora juntar os 11 e 21 dias para descobrir o intervalo de 10 dias para a concepção, que deverá ter sido então entre os dias 14 e 24 de Fevereiro."